productName,reviewText,rating
LV Leather Bag,"Beautiful craftsmanship but the strap broke after a week",2
LV Leather Bag,"Perfect size, feels luxurious and elegant",5
Fendi Wallet,"Loved it! Great quality and packaging",5
Tag Heuer Watch,"Too expensive for the quality, disappointed",2
Tag Heuer Watch,"Classic look and feels premium",4
Fendi Wallet,"The zipper feels cheap, not worth the price",3
LV Leather Bag,"Color faded after one month",1
Tag Heuer Watch,"Absolutely love the design and precision",5
Fendi Wallet,"Perfect size to fit in pockets, stylish",4